{"schema_version":"m1-analysis-1","mode":"analysis_only","order":"source_storage","prediction":{"duration_s":null,"thermal":null,"bond":null},"unmodeled_downstream_passes":["legacy ordering, tool/wipe overrides, speed/acceleration selection","seam placement, scarf seams, loop clipping, path smoothing and arc fitting","travel, retraction, wipe motions and generated wipe-tower G-code","spiral vase (when enabled)","pressure equalization (when enabled)","cooling and fan control","find/replace (when enabled)","custom G-code, Python preprocessing and external postprocessing (when enabled)"],"source_entities":[{"id":1,"parent":null,"child_index":0,"kind":0,"can_reverse":false,"no_sort":true,"loop_role":null,"bead_path":null,"context":{"object":0,"instance":0,"print_object":0,"layer":2,"region":0,"island":1,"configured_tool":0,"material":"PLA","cancel_object":"fixture-object-0","generator":null,"speed_mm_s":null,"source":"fixture","print_z_mm":0.59999999999999998,"shift_scaled":[10000000,20000000],"coordinate_scale_mm":9.9999999999999995e-07},"attributes":{"role_bits":0,"width_mm":-1,"height_mm":-1,"mm3_per_mm":-1,"flow_ratio":1,"maybe_self_crossing":false,"overhang":null,"perimeter_index":null,"feature_id":null,"region_area_mm2":0,"fill_pattern":-1},"points_scaled":[]},{"id":2,"parent":1,"child_index":0,"kind":3,"can_reverse":true,"no_sort":false,"loop_role":null,"bead_path":1,"context":{"object":0,"instance":0,"print_object":0,"layer":2,"region":0,"island":1,"configured_tool":0,"material":"PLA","cancel_object":"fixture-object-0","generator":null,"speed_mm_s":null,"source":"fixture","print_z_mm":0.59999999999999998,"shift_scaled":[10000000,20000000],"coordinate_scale_mm":9.9999999999999995e-07},"attributes":{"role_bits":706,"width_mm":0.45000000000000001,"height_mm":0.20000000000000001,"mm3_per_mm":0.081415926535897937,"flow_ratio":1,"maybe_self_crossing":false,"overhang":null,"perimeter_index":0,"feature_id":7,"region_area_mm2":36,"fill_pattern":-1},"points_scaled":[[-1000000,0],[2000000,0],[2000000,4000000]]},{"id":3,"parent":1,"child_index":1,"kind":3,"can_reverse":true,"no_sort":false,"loop_role":null,"bead_path":2,"context":{"object":0,"instance":0,"print_object":0,"layer":2,"region":0,"island":1,"configured_tool":0,"material":"PLA","cancel_object":"fixture-object-0","generator":null,"speed_mm_s":null,"source":"fixture","print_z_mm":0.59999999999999998,"shift_scaled":[10000000,20000000],"coordinate_scale_mm":9.9999999999999995e-07},"attributes":{"role_bits":513,"width_mm":0.45000000000000001,"height_mm":0.20000000000000001,"mm3_per_mm":0.081415926535897937,"flow_ratio":1,"maybe_self_crossing":false,"overhang":[0.10000000000000001,0.69999999999999996,0.40000000000000002],"perimeter_index":0,"feature_id":7,"region_area_mm2":36,"fill_pattern":-1},"points_scaled":[[-1000000,0],[2000000,0],[2000000,4000000]]},{"id":4,"parent":1,"child_index":2,"kind":3,"can_reverse":true,"no_sort":false,"loop_role":null,"bead_path":3,"context":{"object":0,"instance":0,"print_object":0,"layer":2,"region":0,"island":1,"configured_tool":0,"material":"PLA","cancel_object":"fixture-object-0","generator":null,"speed_mm_s":null,"source":"fixture","print_z_mm":0.59999999999999998,"shift_scaled":[10000000,20000000],"coordinate_scale_mm":9.9999999999999995e-07},"attributes":{"role_bits":8,"width_mm":0.45000000000000001,"height_mm":0.20000000000000001,"mm3_per_mm":0.081415926535897937,"flow_ratio":1,"maybe_self_crossing":false,"overhang":null,"perimeter_index":0,"feature_id":7,"region_area_mm2":36,"fill_pattern":-1},"points_scaled":[[-1000000,0],[2000000,0],[2000000,4000000]]},{"id":5,"parent":1,"child_index":3,"kind":3,"can_reverse":true,"no_sort":false,"loop_role":null,"bead_path":4,"context":{"object":0,"instance":0,"print_object":0,"layer":2,"region":0,"island":1,"configured_tool":0,"material":"PLA","cancel_object":"fixture-object-0","generator":null,"speed_mm_s":null,"source":"fixture","print_z_mm":0.59999999999999998,"shift_scaled":[10000000,20000000],"coordinate_scale_mm":9.9999999999999995e-07},"attributes":{"role_bits":72,"width_mm":0.45000000000000001,"height_mm":0.20000000000000001,"mm3_per_mm":0.081415926535897937,"flow_ratio":1,"maybe_self_crossing":false,"overhang":null,"perimeter_index":0,"feature_id":7,"region_area_mm2":36,"fill_pattern":-1},"points_scaled":[[-1000000,0],[2000000,0],[2000000,4000000]]}],"bead_graph":[{"id":1,"source_entity":2,"role":5,"closed":false,"extrusion_enabled":true,"samples":[[9,20,0.59999999999999998,0.45000000000000001,0.20000000000000001,0],[12,20,0.59999999999999998,0.45000000000000001,0.20000000000000001,0.24424777960769381],[12,24,0.59999999999999998,0.45000000000000001,0.20000000000000001,0.32566370614359175]]},{"id":2,"source_entity":3,"role":5,"closed":false,"extrusion_enabled":true,"samples":[[9,20,0.59999999999999998,0.45000000000000001,0.20000000000000001,0],[12,20,0.59999999999999998,0.45000000000000001,0.20000000000000001,0.24424777960769381],[12,24,0.59999999999999998,0.45000000000000001,0.20000000000000001,0.32566370614359175]]},{"id":3,"source_entity":4,"role":6,"closed":false,"extrusion_enabled":true,"samples":[[9,20,0.59999999999999998,0.45000000000000001,0.20000000000000001,0],[12,20,0.59999999999999998,0.45000000000000001,0.20000000000000001,0.24424777960769381],[12,24,0.59999999999999998,0.45000000000000001,0.20000000000000001,0.32566370614359175]]},{"id":4,"source_entity":5,"role":7,"closed":false,"extrusion_enabled":true,"samples":[[9,20,0.59999999999999998,0.45000000000000001,0.20000000000000001,0],[12,20,0.59999999999999998,0.45000000000000001,0.20000000000000001,0.24424777960769381],[12,24,0.59999999999999998,0.45000000000000001,0.20000000000000001,0.32566370614359175]]}],"certification":{"status":"analysis_only","source_complete":true,"issues":[]}}
